date,event_description,location,category
1789-07-14,"Восставшие парижане взяли штурмом крепость-тюрьму Бастилию, символ королевского абсолютизма. Комендант де Лоне убит. Начало Великой французской революции.","Париж, Франция",Политика/Революция
1789-05-05,"В Версале открылись Генеральные штаты, созванные королем Людовиком XVI для решения финансового кризиса.","Версаль, Франция",Политика
1789-08-26,"Национальное собрание Франции приняло Декларацию прав человека и гражданина.","Париж, Франция",Право/Политика
1776-07-04,"Второй Континентальный конгресс принял Декларацию независимости США, провозгласив отделение 13 колоний от Великобритании.","Филадельфия, США",Политика/Война
1812-09-07,"Бородинское сражение между русской армией под командованием Кутузова и французской армией Наполеона. Считается самым кровопролитным однодневным сражением той эпохи.","с. Бородино, Россия",Война
1812-06-24,"Великая армия Наполеона перешла реку Неман, начав вторжение в Российскую империю.","р. Неман",Война
1861-03-03,"Император Александр II подписал Манифест об отмене крепостного права в Российской империи.","Санкт-Петербург, Россия",Политика/Реформы
1917-11-07,"В Петрограде произошло вооруженное восстание большевиков (Октябрьская революция), Зимний дворец взят, Временное правительство арестовано.","Петроград, Россия",Политика/Революция
1961-04-12,"Советский космонавт Юрий Гагарин совершил первый в истории человечества полет в космос на корабле 'Восток-1'.","Космос/Байконур",Наука/Технологии